Wikipedia_movie_ID,Freebase_movie_ID,Movie_name,Movie_release_date,Movie_box_office_revenue,Movie_runtime,Movie_languages,Movie_countries,Movie_genres,Decade,Movie_continent,Grouped_genres,plot_summary
1395159,/m/04z5ml,Clockstoppers,2002.0,38793283.0,93.0,['English Language'],['United States of America'],"['Thriller', 'Science Fiction', 'Adventure', 'Comedy', 'Family Film', 'Teen']",2000.0,North America,"['Science Fiction', 'Thriller', 'Teen', 'Action/Adventure', 'Family', 'Comedy']","The NSA-funded QT  Corporation has slated a project to develop Hypertime, a technology which allows the user's molecules to speed up to the point where the world appears to be standing still. After realizing that such technology, contained within a wristwatch frame, could also be used against the USA, the NSA orders the project stopped. However, the research is farther along than the NSA expected and QT's leader Henry Gates plans on using the technology to usurp the leader of the NSA and dominate the world. He uses the prototype to stretch the weekend in order to give the brilliant lead scientist Earl Dopler time to fix the remaining glitch in the technology after his henchmen Richard and Jay prevent Earl's incognito departure at the airport. However, the disadvantage of Earl being in Hypertime for too long was him aging rapidly in real time, as his molecular age continued at the same rate despite time slowing down. However, initially unknown to Gates, Dopler had sent a prototype to a former colleague of his named Dr. George Gibbs. His son Zak discovers the watch accidentally and initially uses it for fun, much to the amusement of Francesca. Once Gates finds out about the leaked prototype, he attempts to retrieve it. He sends his henchmen after Zak who break into his house and search for evidence. Upon learning about the ulterior motive of QT Corporation, Zak sets out to warn his father of the danger he could be in. A chase sequence ensues, with Zak crashing the car into the river and thus damaging the watch. He awakes in hospital with a broken watch and only by a stroke of luck manages to avoid Jay and Richard again. He then goes in search of somewhere safe to hide in the meantime, after having been accused of stealing a van by the police. In a bid to retrieve the watch, QT Corporation enlists the help of national security agencies and portray Zak and his father as fugitives wanted by the law. Zak goes on the run with his girlfriend, locating the hotel that Dr. Gibbs was staying at in a bid to warn him. Dopler is also looking for Dr. Gibbs to ask for help and also to warn him. However, Gates, Jay, and Richard reach Zak's father before him and kidnap Dr. Gibbs from his hotel room. Unable to reach his father in time, Zak and Francesca wander the streets aimlessly before being forcibly picked up by Earl Dopler, who wants the watch back. The teens take Dopler hostage and force him to do as they request. As Dopler feels that Dr. Gibbs has been kind to him, he reluctantly agrees to help save Dr. Gibbs. Dopler helps mend the broken watch as well as creating guns which can take someone out of Hypertime and back into normal time. The guns are loaded with paintballs filled with frozen nitrogen, and the low temperature 'freezes' a hit person back into normal time. Dopler helps the kids break in but decides not to go as well. They get caught by Henry Gates, Richard, and Jay. Zak and Francesca are thrown in a cell with Zak's dad. Zak accelerates while in Hypertime and becomes ""light"" . They then manage to break out as the NSA Agents arrive and defeat Gates' goons. Gates is not defeated and knocks Francesca out of hypertime and prepares to do the same to Zak and his dad. Suddenly he's shot with a paintball by Dopler who returned to help and Dopler shoots Gates until he reverts to normal time, defeating him. Gates and his henchmen are arrested, and the watches are confiscated. Following the arrest of Gates, Jay, and Richard. Dopler uses the machine he was building to reverse the aging effects of hypertime that happened to him, but it inadvertently changes him back into a teenager , meaning he will have to live with the Gibbs for a few years. The movie ends with Zak and his family happily together, and with Zak finally getting the car he wanted. As Zak speeds off in his car with Francesca, now his girlfriend, sister and teenage Dopler, it is revealed that he has not returned the watch after all, as he goes into Hypertime to have some fun."
26970731,/m/0bryfqz,Crosstalk,1982.0,,83.0,[],[],"['Thriller', 'Crime Fiction', 'Science Fiction']",1980.0,Unknown,"['Science Fiction', 'Thriller', 'Fiction']",A highly advanced computer witnesses a murder and resorts to violence to protect its own future.{{cite book}}
12165949,/m/02vs16l,The 11th Hour,2007.0,985207.0,95.0,['English Language'],['United States of America'],"['Drama', 'Culture & Society', 'Environmental Science', 'Social issues', 'Documentary']",2000.0,North America,"['Culture & Society', 'Drama', 'Documentary', 'Environmental Science', 'Social']","With contributions from over 50 politicians, scientists, and environmental activists, including former Soviet leader Mikhail Gorbachev, physicist Stephen Hawking, Nobel Prize winner Wangari Maathai, and journalist Paul Hawken, the film documents the grave problems facing the planet's life systems. Global warming, deforestation, mass species extinction, and depletion of the oceans' habitats are all addressed. The film's premise is that the future of humanity is in jeopardy. The film proposes potential solutions to these problems by calling for restorative action by the reshaping and rethinking of global human activity through technology, social responsibility and conservation."
444061,/m/02961b,Idaho Transfer,1973.0,,86.0,['English Language'],['United States of America'],"['Science Fiction', 'Time travel']",1970.0,North America,"['Science Fiction', 'Time travel']","Teenager Karen Braden  is a troubled mental hospital outpatient who is taken by her father George and sister Isa to a government facility near the Craters of the Moon lava fields in Idaho. The project there was commissioned to develop matter transference, but made a different discovery: time travel. They also discovered that a mysterious ecological catastrophe will soon wipe out civilization. The time travel process has negative health effects, though. Adults ""not much older than 20"" are unable to survive for long, as their kidneys hemorrhage shortly after the experience. So the scientists decide to only send young people 56 years into the future so they can build a new civilization. After the government takes over the project, the transfer machines are turned off, trapping a large number of project members in the future. Now trapped, they begin exploring the future world."
31424530,/m/0gk__q3,Gashole,,,102.0,[],[],['Documentary'],,Unknown,['Documentary'],"The documentary starts with describing of the technology that they claim has been 'buried and hidden, despite of its ability of gas mileage improvement in cars and also reducing oil consumption'.http://gasholemovie.com/synopsis.html"
31718044,/m/0gmg8ls,Doctor Ahrendt's Decision,1960.0,,81.0,['German Language'],['German Democratic Republic'],['Drama'],1960.0,Europe,['Drama'],"Dr. Ahrendt developed a new model of an iron smelter. When his invention fails to produce the required results, he begins to doubt himself, and is even considered as a liar by some. However, the workers in the factory are determined to achieve the goals set forth, and together with the scientist they manage to prove that the machine can be used as planned."
24313378,/m/07sb0pj,Tin Man,1983.0,,89.0,['English Language'],['United States of America'],['Drama'],1980.0,North America,['Drama'],"A young auto mechanic, born deaf, invents a computer so he can hear and speak with others. When he attempts to patent his invention he is taken advantage of by a self-serving salesman."
29460128,/m/0drzhrn,Prime Risk,1985.0,,98.0,['English Language'],['United States of America'],['Drama'],1980.0,North America,['Drama'],"A female engineer, with the assistance of her pilot-wannabe male friend, discovers a way to rip off automated teller machines, but in doing so stumbles upon a plot to destroy the U.S. monetary system."
28492979,/m/0crgb1y,Bunarman,2003.0,,30.0,['English Language'],['Croatia'],"['Short Film', 'Documentary']",2000.0,Europe,"['Documentary', 'Short Film']","The film's protagonist is a master of a dying trade: he excavates wells without using machines, relying only on hand tools. This approach is not just highly demanding physically, but also requires well-thought out methods and resourcefulness.http://www.istvancic.com/bunarman.htm {{hr icon}}"
34047812,/m/0h2b9_6,Mine Games,2012.0,,,['English Language'],['United States of America'],['Thriller'],2010.0,North America,['Thriller'],"While exploring an abandoned mine, a group of friends make an incomprehensible discovery. They become caught in a causality loop and the more they try to change future events, the more their efforts solidify the future they wish to avoid."
34183993,/m/0h25lcg,The Congress,2013.0,,,['English Language'],['United States of America'],['Science Fiction'],2010.0,North America,['Science Fiction'],"In the story, an aging actress with a disabled child agrees to a large payment to have a full body imaging that will be digitized and utilized to create a digital actress. As part of the agreement, she will no longer control her likeness and the studio will then utilize the new virtual thespian in any manner they see fit. As part of the agreement, she will also be forbidden from acting ever again. The film explores the ramifications of how the new digital actress affects the future of the woman and society as a whole."
7088758,/m/0h3lsz,The Movie From the Future,2000.0,,,['English Language'],['United States of America'],"['Science Fiction', 'Comedy']",2000.0,North America,"['Science Fiction', 'Comedy']","The Movie From the Future is a movie within a movie. The set-up is you are watching an Unsolved Mysteries type program about a video tape found in a crater with a note reading ""From Future."" Most of the movie consists of the contents of the tape with various experts breaking in to offer their opinions on the validity of the tape or whether it is a hoax. The contents of the tape seem to be a made-for-television feature from the future about inter-species love, futuritistic inventors, and plans to destroy the world by aliens and the robots attempting to thwart them."
2350185,/m/075sbp,Teknolust,2002.0,,83.0,['English Language'],"['United States of America', 'United Kingdom', 'Germany']","['Parody', 'Romantic comedy', 'Sex comedy', 'Indie', 'Science Fiction', 'Drama', 'Comedy', 'Romantic drama', 'Black comedy', 'Romance Film']",2000.0,North America,"['Science Fiction', 'Drama', 'Indie', 'Sex', 'Comedy', 'Parody', 'Romance']","The film is about the scientist Rosetta Stone  who injects her DNA into three Self Replicating Automatons . These cyborg clones must habitually venture into the real world in order to obtain a supply of Y chromosome in the form of semen to keep them alive. Unfortunately, their periodic treks into the outside world seem to leave the males they obtain the chromosome from, with a strange virus that overtakes both their bodies and their computers. Unfortunately the lust carries over into the technology leaving the males' world aghast."
24089186,/m/07k5w22,The Possibility of Hope,2007.0,,105.0,[],['United Kingdom'],"['Short Film', 'Documentary']",2000.0,Europe,"['Documentary', 'Short Film']","A look at different matters of the world such as immigration, global warming and capitalism through the eyes of scientists and philosophers."
35002618,/m/0j63xqm,Afro@Digital,2002.0,,52.0,[],['Democratic Republic of the Congo'],['Documentary'],2000.0,Africa,['Documentary'],"Afro@Digital explores how digital technology has changed the lives of Africans. For instance, a marabout explains that he no longer replies by letter to questions from Africans living abroad: he uses his cell phone. Another eloquent illustration of the digital revolution in Africa is the proliferation of Internet cafés full of young people. It raises challenging questions about the use of technology in various domains, and in documenting humanity's memory and also asks how digital technology might be used in the service of African people tomorrow."
31908,/m/07vcx,Until the End of the World,1991.0,752856.0,280.0,"['French Language', 'Japanese Language', 'Italian Language', 'German Language', 'English Language']","['France', 'Australia', 'Germany']","['Road movie', 'Science Fiction', 'Drama', 'Adventure', 'Existentialism']",1990.0,Europe,"['Science Fiction', 'Action/Adventure', 'Drama', 'Existentialism', 'Road']"," The film takes place in late 1999. India has an out-of-control nuclear satellite in orbit that is about to reenter the atmosphere at any time, contaminating large areas of the earth. This has caused a massive panic, with everyone trying to flee the likely impact sites. Caught in a traffic jam, impatient and disconnected Claire Tourneur  escapes the highway congestion by taking a side road. Her Dashboard Computer System announces she left the Map Zone Database and is on her own. She then has a couple of odd encounters: first with a pair of bank robbers , and with a hitchhiker being pursued by an armed party. Claire discovers, after falling in love with the enigmatic fugitive, that he is the son of a scientist , and has absconded with the prototype of a secret research project. Multiple government agencies and freelance bounty hunters are chasing him to recover the device. The film has two distinct parts: the first is a mystery; the second a science-fiction adventure. The mystery is about the prototype, what it actually does and why so many people are interested in it. Halfway through the film the focus shifts, as the prototype is revealed to be a device for recording and translating brain impulses— a camera for the blind. The hitchhiker is traveling around the world, gathering images in the device though the reason why is not revealed. During the second part, the reason for his travels is revealed: the hitchhiker has been filming his extended family to bring home to his blind mother . As the chase moves across the globe, the nuclear satellite is shot down, causing an EMP effect that wipes out all unshielded electronics worldwide. The characters wind up in a cave in the Australian Outback, where the recordings are played back. After the death of the hitchhiker's mother, his scientist father discovers a way to use the device to record human dreams. Several characters become addicted to viewing their own dreams, while Claire's estranged lover, a novelist, remains unaffected. He writes a novel about the adventure, which ultimately rescues Claire from her addiction to the device, via the power of words."
12790367,/m/02x519s,Vexille,2007.0,,111.0,['Japanese Language'],['Japan'],"['Science Fiction', 'Japanese Movies', 'Computer Animation', 'Animation', 'Anime', 'Action']",2000.0,Asia,"['Action/Adventure', 'Science Fiction', 'Japanese Movies', 'Animation']","By the 2060s, robotics technology has become extremely advanced, including cybernetics. World opinion begins to turn against robotics, leading to the U.N. declaring a unilateral ban on further research in 2067. Japan, being home to robotics pioneer Daiwa Heavy Industries, strongly protests this ban, but is unable to prevent its passage. In protest, Japan withdraws from international politics. All foreigners are deported, and further immigration is prohibited. In addition, the R.A.C.E. network is constructed&nbsp;— 270 off-shore installations that cover Japan with an energy field, nullifying all communication with the outside world and making satellite surveillance impossible. Trade and diplomacy continues, but Japan vanishes from the world scene. Ten years later, the United States Navy special warfare unit ""SWORD"" is trying to trap a Japanese informant for Daiwa in Colorado. The instigator, Saito, escapes by cutting off his own leg. Analysis shows the leg is made of bio-metal. SWORD suspects that Japan has concealed extensive development of banned technologies. They embark on an unapproved scheme to infiltrate Japan and to find out the frequency of the R.A.C.E. network, enabling SWORD to gather intelligence on the country. Although the agents successfully enter Japan, they are detected by security forces before they can transmit their data. Vexille is the sole SWORD agent to evade capture, and only her lover Leon survives to be taken to Daiwa's headquarters. Vexille awakens to find Tokyo is now a shanty town ruled by Daiwa. A small resistance movement opposes the company, and uses Vexille's transmitter to successfully transmit the distortion frequency. Maria, the head of the resistance, details the 10 years of secrecy while SWORD studies Japan in shocked horror — the islands are a lifeless wasteland. In 2067, an unknown disease struck Japan and was countered by an experimental vaccine. Actually, the disease was created by Daiwa and the ""vaccine"" was used as an excuse for Daiwa to begin testing experimental nanotechnology. Every Japanese citizen was converted into a form of synthetic life. But there were unforeseen side effects; the conversion was imperfect, resulting in the infected humans losing their free will and becoming just lifelike machines. Some of the nanotech went amok, creating the ""Jags"", giant whirling constructs of semisentient metal that prowl the wilderness. The Jags destroyed all of Japan, save Tokyo which is protected by an inedible wall of ceramic. The Resistance plans to draw the Jags along a service bridge to Daiwa's corporate headquarters, which now stands in the middle of Tokyo Bay. Vexille volunteers her assistance . However, though Vexille and Maria succeed in drawing the Jags to the end of the service bridge, the bridge has been detached from the headquarters, the Jags fall into the sea, and Vexille and Maria are captured. They are taken to Kisaragi, the master of Daiwa, who boasts that his research is nearly complete. And as he needs more test subjects, he is going to invade America. Vexille attacks him with a hidden knife, revealing that his blood is still human&nbsp;— he has not used the process himself. Saito, then strangles him. The town council forces the ceramic gates open, destroying Tokyo and enabling the Jags to enter Daiwa's headquarters. Kisaragi, having somehow survived, shoots Saito and escapes with his research. The underling then releases Vexille and Maria before succumbing to his wounds. Vexille pursues Kisaragi while Maria frees Leon, who shows concern for Vexille, angering Maria. Thus when Vexille prevents Kisaragi's escape in a helicopter, Maria grabs him and holds them together as a Jag devours them. Vexille and Leon are rescued by a SWORD helicopter just as Daiwa headquarters collapses into the bay, along with every Jag in Japan. As Vexille and Leon are flown from a now completely lifeless Japan, Vexille comments that humanity's spirit can never be taken away."
14743458,/m/03gw9dr,Transcendent Man,2009.0,,83.0,['English Language'],['United States of America'],"['Culture & Society', 'Inventions & Innovations', 'Documentary']",2000.0,North America,"['Culture & Society', 'Documentary', 'Inventions & Innovations']","Raymond Kurzweil, noted inventor and futurist, is a man who refuses to accept the inevitability of physical death. He proposes that the Law of Accelerating Returns—the exponential increase in the growth of information technology—will result in a ""singularity"", a point where humanity and machines will merge, allowing one to transcend biological mortality: advances in genetics will provide the knowledge to reprogram biology, eliminate disease and stop the aging process; nanotechnology will keep humans healthy from the inside using robotic red blood cells and provide a human-computer interface within the brain; robotics, or artificial intelligence, will make superhuman intelligence possible, including the ability to back up the mind. Against this optimistic backdrop of human and machine evolution, concerns about Kurzweil's predictions are raised by technology experts, philosophers, and commentators. Physician William B. Hurlbut warns of tragedy and views Kurzweil's claims as lacking a more moderate approach necessitated by biological science. AI engineer Ben Goertzel champions the transhumanist vision, but acknowledges the possibility of a dystopian outcome. AI researcher Hugo de Garis warns of a coming ""Artilect War"", where god-like artificial intellects and those who want to build them, will fight against those who don't. Kevin Warwick, professor of Cybernetics at University of Reading, advocates the benefits of the singularity, but suggests the Terminator scenario could also occur. Dean Kamen observes that advances in technology have finally made immortality a reasonable goal."
23621133,/m/06zk0v2,Freedom Machines,2004.0,,76.0,"['English Language', 'Spanish Language']",['United States of America'],"['Illnesses & Disabilities', 'Culture & Society', 'Inventions & Innovations', 'Social issues', 'Documentary']",2000.0,North America,"['Culture & Society', 'Documentary', 'Inventions & Innovations', 'Illnesses & Disabilities', 'Social']","Freedom Machines studies the concept of diversity through the intimate stories of adults and children with disabilities who are using modern technologies to change their lives. Among them are Susanna who is beginning her college career, 38 year old Floyd Stewart who was paralyzed in mid-life while raising four children; 92 year old Gladys who is determined to overcome a hearing loss; and high school student Latoya Nesmith who dreams of becoming a translator at the United Nations. Fifteen years after passage of the Americans with Disabilities Act of 1990, Freedom Machines is a reflection on the status of life of America's largest minority group: 54 million people with disabilities.  with running times  * Susanna - Growing Up with Technology  * The Movement for Civil Rights  * Bonita - Reaching Beyond Expectations  * Floyd - The Accident of Disability  * Shoshana & Jackie Brand - Breaking Through & Parent Advocacy  * Latoya - Public Education & the Law  * Gladys - Challenging the Limits of Age  * Bonita - Seeking Employment  * Floyd - Independence and Public Policy  * Funding Assistive Technology  * Latoya - A New High School  * Susanna - First Day of College  * Kent Cullers - A Life in Science  * Dean Kamen & Others - Designing An Accessible World  * End Credits   with running times  * Technology for You  * Getting the Technology You Need  * Your Legal Rights  * Designing for Everyone"
