Wikipedia_movie_ID,Freebase_movie_ID,Movie_name,Movie_release_date,Movie_box_office_revenue,Movie_runtime,Movie_languages,Movie_countries,Movie_genres,Decade,Movie_continent,Grouped_genres,plot_summary
26443837,/m/0bbv1y3,Annihilation Earth,2009.0,,,[],[],"['Science Fiction', 'Action']",2000.0,Unknown,"['Action/Adventure', 'Science Fiction']","{{Plot}} The film opens as a team of scientists in the year 2020 wander through a post-apocalyptic wasteland, with the team leader calling for help on a radio, until they come upon the ruins of a city. Forty-eight hours earlier, David Wyndham , the same team leader, is informed by his UN superior, Paxton  of a security breach involving another scientist on their project, David's friend and colleague Raja. Unauthorized access of the project's mainframe the night before was made using Raja's access codes. As a precaution he has been removed from the project; but David suspects a more sinister motive. Paxton holds a press conference about their project, codenamed ""EVE"" , which has provided most of Europe's energy for the past ten years beginning in 2010. The project utilizes three high-power particle colliders, located in Geneva, Barcelona, Spain, and Orleans, France. With the project's continuing success, Paxton is enthusiastic that the technology can be utilized worldwide. David, unhappily agreeing with Paxton's claims, confronts her afterward that she has no intention of sharing the technology with the Middle East, which she verifies. Outside the meeting hall David receives a mysterious phone call, then is approached by a reporter, whom he dismisses with a handshake. The reporter furtively copies David's fingerprint from his hand using a piece of tape and stores it in a case. A countdown appears on the screen, reading ""84 Hours to Extinction."" At home, David receives a visit from Raja , who has already surmised that Paxton's plans for the technology. Raja believes he is a scapegoat for the security breach because he is the only Arab with level 5 project clearance. When David rejects his claims, Raja angrily leaves. That night, the ""reporter"" that accosted David dons a lab coat and fake ID to sneak into the Orleans facility. After using a recording of David saying his name and the copied fingerprint to gain access to the lab, he enters a series of codes into the computer. When he is confronted by another employee he uses a silenced dart gun to kill the man. A short time later, after the mysterious man has escaped, the plant explodes, destroying Orleans and a quarter of France including Paris, killing between 20,000,000-30,000,000 people. As he tries to sort out what happened the next day, David meets with Raja again. Raja has been named the top suspect and is running from the police. He is also being watched by Paxton's men, which David learns from Paxton herself. She shows him photos of Raja apparently meeting with the mystery man, a known terrorist named Aziz Khaled. Though stunned by this revelation, David insists he be allowed to go to ground zero to investigate the explosion before judgments are made. Later that night, Raja, pursued by both Paxton's men and the French police, attempts to board a train before being cornered in an underground station. A sudden earthquake allows him to escape. Paxton, watching in her office, nearly cries when the worst hit area by the earthquake is the Middle East, specifically Bahrain, where thousands have perished due to the quake. The next day, Raja calls David near the French-Spanish border, revealing that because the earthquake happened one day after the blast and hit where the EVE grid was absent. He deduces that someone has discovered the Doomsday Equation, which is a set of codes for each collider that, if used, could destroy the world. David and his team travel to Orleans via helicopter but they crash, killing the pilot. They find evidence that a Higgs field has formed, confirming Raja's suspicions. Meanwhile, Raja's electric car runs out of power at the border, leaving him helpless. A few hours later he is abducted by Khaled. David's team, meanwhile, attempts to escape France in a Humvee sent to rescue them only to be caught in a meteor shower. To his horror the ""meteors"" are actually falling satellites, and his team barely escapes. Khaled takes Raja to the Barcelona facility. After murdering all the workers and ordering his men to get as far away as possible, he tries to force Raja into giving him the site's Doomsday Equation, believing the meltdown will not cause the end of the world, but Raja steadfastly refuses. After returning to Geneva, David is taken to the facility, where his family is already sheltered. He concludes that the surviving colliders are feeding the magnetic field, and asks Paxton to order a full system shutdown. After becoming tired of Raja's stubborn defiance, Khaled shoots him in the knee, but doesn't see him grabbing a pen. Raja stabs Khaled in the leg, stunning him. He then shoves the terrorist into the reactor's shaft and Khaled falls to his death. Raja returns to the computer and opens an instant message to Geneva, telling David his suspicions about the Doomsday Equation were right - and the only way to save the world is to increase the system's output and choke the field out of existence, otherwise it will expand into a black hole. Still believing Raja is a terrorist, Paxton cuts the connection and a tearful and distraught David has no choice but to carry out the system shutdown, knowing that this action will only seal the doom of the entire planet and everyone and everything on it. The system announces that the full shutdown will take twenty seconds. David joins his family at the window overlooking the reactor and solemnly assures his oblivious family that things will be okay now that he's fixed the problem. As soon as the system shutdown is complete, the Geneva facility melts down in an explosion exponentially larger than the Orleans disaster. Everything and everyone, including David, his family, the facility's staff, and Paxton, within hundreds of miles of Geneva are incinerated in an instant. A view from outer space shows shock waves from the blast radiating throughout the Earth's surface, a large fissure forming in Europe and cracks forming around the globe. Finally, the Earth's core is breached, and the planet explodes violently. Nothing survives. The film concludes with a shot of pieces of what was once Earth floating through space, followed by a blank screen reading simply, Extinction."
7596042,/m/0kvc36,Lawnmower Man 2: Beyond Cyberspace,1996.0,,92.0,['English Language'],['United States of America'],"['Science Fiction', 'Horror']",1990.0,North America,"['Science Fiction', 'Horror']","The founder of virtual reality, Dr. Benjamin Trace , has lost a legal battle to secure a patent on the most powerful worldwide communications chip ever invented. Touted as the one operating system to control all others, in the wrong hands the ""Chiron Chip"" has the potential to dominate a society dependent on computers. When corporate tycoon and virtual reality entrepreneur Jonathan Walker ([[Kevin Conway  takes over development of the Chiron Chip, he and his team discover Jobe Smith  barely alive after the explosion at the end of the first film. Reconstructing his face and hooking him up to their database, they plan to use Jobe to help them perfect the Chiron Chip. Six years later, a now 16-year-old Peter Parkette  is a computer hacker and lives in the subways of Los Angeles with his girlfriend and two other friends. While hooked into cyberspace, Jobe reconnects with Peter and asks him to find Dr. Trace for him. After Peter finds Trace, they discover that Jobe is back to his old ways and plots to finish what he started in the first film. Joining forces with Trace's former lover, Trace, Peter and his friends must go on a race against time to save the world from Jobe's diabolical scheme and face him in one last battle in cyberspace. In the end, Trace defeats the villain with help from Jobe who turns back into his former good self."
1134373,/m/0496t9,Primer,2004.0,424760.0,77.0,['English Language'],['United States of America'],"['Thriller', 'Science Fiction', 'Indie', 'Psychological thriller', 'Drama', 'Time travel']",2000.0,North America,"['Science Fiction', 'Thriller', 'Drama', 'Indie', 'Time travel']","Four engineers—Aaron , Abe ([[David Sullivan , Robert, and Phillip—who work for a large corporation during the day, run a side business from Aaron's garage at night, building and selling JTAG cards. With the proceeds of this work they fund pet science projects that they hope will yield applications sufficient to attract ""VC attention"". After arguing over the project that the group should tackle next, Aaron and Abe independently pursue work on technology intended to reduce the weight of an object. Although the device seems to work as planned, it has a side effect: a timepiece left in the device shows the watch has experienced about 1300 times the amount of time the device was activated for. Abe reasons that they have created a time machine.  After some testing, Abe secretly builds a prototype machine large enough to hold a person and, after traveling back to earlier that day, details the results to Aaron. Abe and Aaron build an additional machine  and decide to cut Robert and Phillip out of the discovery, under the false pretense that the garage has to be fumigated. Abe and Aaron start using the time machines to make money in the stock market, but as their understanding of how the machines work evolves, they become more adventurous with their trips. Their experimentation is cut short by the unexpected appearance of Thomas Granger , the father of Abe's girlfriend Rachel, whose financial backing the group had been trying to procure. Granger's trip appears to have made him comatose, and neither understand how Granger could have discovered the box. Abe is particularly disturbed by this turn of events and concludes that time travel is too dangerous to continue. He attempts to prevent his past self from using the machine for time travel, thereby nullifying all of its consequences, by using a ""failsafe"" machine, which he previously built in secret, to travel back to a point prior to his first trip through time and also prior to his broaching the subject of time travel with Aaron. Having traveled back four days in time using this failsafe point, Abe goes to meet Aaron and collapses. After Abe recovers, Aaron reveals that unbeknownst to Abe, Aaron had discovered this failsafe box and used it to get control. Aaron brought back another box, creating a false failsafe point to make Abe believe that there was still a working failsafe machine awaiting him, and preventing Abe from undoing Aaron's actions. Aaron then reveals that he has been using a recording to recite their conversation from an earlier time. He continues to explain how he encountered, fought, and was subdued by a previous version of himself who used the failsafe to come back and make recordings after drugging the original Aaron. But Aaron convinced his earlier self that since he has the recordings already made that he should continue to act as Aaron. The earlier Aaron leaves, leaving the later Aaron to his plan to redo the events of a party in which a crasher attempted to shoot Rachel Granger so Aaron can become a hero. Abe agrees to try to change the events of the party with Aaron and the two succeed, though it is unclear how many iterations it has taken. Their deceptions and their differing views on the use of the machines unfortunately have destroyed their friendship. Aaron accuses Abe of coveting his family and Abe warns Aaron never to return or interfere with their doubles. Abe stays behind to continue his plan of attempting to prevent the original Abe and Aaron from this timeline — who have no idea of what the others have done — from ever using the machines for time travel, suggesting that he would tamper with the machines in the hope that their doubles would think the experiment a failure and move on to other projects. The earlier Aaron who came back in the failsafe to make the recordings speaks on the phone to an unspecified recipient to which Aaron states he owes a debt. One of the Aarons and a team of French-speaking workers begin construction on what appears to be a building-sized box."
1103547,/m/0467wt,Brainstorm,1983.0,,106.0,['English Language'],['United States of America'],"['Thriller', 'Science Fiction', 'Psychological thriller']",1980.0,North America,"['Science Fiction', 'Thriller']","A team of scientists invents ""the Hat"", a brain/computer interface that allows sensations to be recorded from a person's brain and converted to tape so that others can experience them. The team includes estranged husband and wife Michael and Karen Brace , as well as Michael's colleague Lillian Reynolds . At CEO Alex Terson's  instruction, the team demonstrates the device to gain financing for further development. One team member, Gordo , has sexual intercourse while wearing the recorder, and shares the tape with other colleagues, including Hal Abramson . Hal splices one section of the tape into a continuous orgasm, which results in sensory overload that nearly kills him - leading to his forced retirement. Tensions increase as the possibilities for abuse become clear. Karen dons the recorder while working with Michael and Lillian. When Michael plays the tape back, the group realizes that emotional experiences are also recorded. Michael makes a tape of his memories, which he shares with Karen, leading to their reconciliation. Lillian is pressured by backers to admit a former colleague, Landon Marks , whom she sees as part of the military industrial complex. She refuses to have the invention taken over for military use. This stress, coupled with the cumulative effects of her lifestyle, causes Lillian to suffer a heart attack while working alone. Realizing that help cannot reach her in time, she dons the Hat and records her experience as she dies. Following her funeral, Michael decides to experience Lillian's final recording, but nearly dies when the playback causes his body to actually simulate the sensations and effects of a heart attack. Michael modifies his playback console to disconnect the heart and respiration output from the recording. A team of military scientists wanting to discover the Hat's capabilities monitors the equipment, discovering Michael's attempt to replay Lillian's death tape, and force Gordo to experience the playback at the same time as Michael, but with his heart and respiration connected to the simulation - leading to Gordo's death. As a safety measure, Alex orders that the central playback facility be shut down. Michael's experiment is cut short, but witnessing what is essentially a digital near-death experience makes him curious to see the entire tape. The recording is locked away and Michael is told he will never be allowed to view it. Michael protests, but Alex removes him and Karen from the team. Michael makes several attempts to hack into the lab's computers. Hal advises him to look under ""Project Brainstorm"", a program which, Michael learns, the military has created to re-develop the Hat for torture and brainwashing. Michael and Karen's son Chris is inadvertently exposed to one such ""toxic"" tape, causing him to have a psychotic experience which results in his hospitalization - where the Braces have a confrontation with Alex over Project Brainstorm. Michael vows to destroy Brainstorm, and enlists the help of Karen and Hal. Michael and Karen head to a hotel and, realizing they are under surveillance, stage a fight that results in Karen's leaving for Hal's house. As the two feign reconciliation over the phone, Michael accesses the Brainstorm computer via another phone line, while Karen hacks into the system and reprograms the factory robots that manufacture the Hat. The machines go berserk, creating havoc. Michael shuts down the security system, trapping the staff inside, allowing him to remotely load Lillian's death tape and experience it without interruption. Brainstorm's leaders order his arrest. Michael flees the hotel, heading for a phone booth at the Wright Brothers National Memorial, located in Kill Devil Hills, North Carolina. He hacks into the computers again and accesses the final part of the death tape, after the point of Lillian's physical death. While viewing Lillian's death experience, he sees ""memory bubbles"". Michael experiences Lillian's memories of a humorous meeting with Michael and an early robot, a surprise birthday party, and being devastated when Alex tells her that an earlier project was cancelled. Karen arrives at the Wright Brothers Memorial while the tape is still playing. To his awe, Michael bears witness to the Afterlife; Lillian experiences a brief vision of Hell before travelling away from Earth and through the universe, even after the tape ends, ultimately witnessing visions of angels and departed souls flying into a great cosmic Light. Michael then collapses in an apparent coma. Karen sobs, pleading for Michael to come back. Awakening from the experience, he weeps with joy."
24540983,/m/05231y3,2B - The Era of Flesh is Over,,,92.0,[],['United States of America'],['Science Fiction'],,North America,['Science Fiction'],"Set in the near future, 2B portrays a familiar decaying world on the cusp of ""great transformation and awesome wonders"". The story is based upon real science and evolving technologies. When the world's first transhuman is created by a renegade corporate CEO and bioscientist, the foundations of society's beliefs are threatened in a transhuman world where man merges with technology.World Premiere, [[Woodstock Film Festival], Retrieved 2012-06-05]"
